"3M_25May18","2018-05-25","2018-06-16",NA,NA,22,NA,0,"3M",41.71562,-122.00277,"Mule Deer","54","WB, EW","Mt Hebron","No sign of 3M upon approach.","Adult","Male",NA,NA,0,0,FALSE,FALSE,FALSE,FALSE,FALSE,0,0,0,0,0,0,0,0,0,0,0,0,0,0,0,0,0,0,0,NA,NA,0,0,0
"3M_26Nov18","2018-11-26","2018-12-20","2018-11-26 10:39:47","2018-12-05 10:19:42",24,8.98605324074074,4900,"3M",41.70859,-121.98337,"Mule Deer","54","WB, EW","Shafter CG","Strong beacon from 3M's collar at road but no sign of him at cluster.","Adult","Male","3M","UNKNOWN; EAGLE golden; MAGPIE; RAVEN common; SKUNK striped; EAGLE bald; COYOTE; BEAR black; MOUSE; FOX gray; PUMA",11,0,FALSE,TRUE,FALSE,TRUE,TRUE,0,0,0,0,0,0,0,50,0,0,0,1,0,0,50,5031.327,0,45.3272702702703,0,44.8141268996824,0,83.85545,7.81511666666667,1077.74205
"3M_27Sep17","2017-09-27","2017-10-20","2017-09-27 10:08:23","2017-10-11 14:41:21",23,14.1895601851852,1210,"3M",41.64306,-122.21386,"Mule Deer","53","RL, guest","Herd Peak","Scavenger sign notes need to be updated with deployment vs retrieval.","Adult","Female","3M; PUMA uncollared","UNKNOWN; SQUIRREL golden-mantled ground; FOX gray; CHIPMUNK; SKUNK striped; SQUIRREL Douglas; SKUNK western spotted; JAY Stellar's; BEAR black; PUMA",10,0,TRUE,TRUE,FALSE,FALSE,TRUE,0,0,0,0,0,0,0,74,1,13,0,6,0,0,74,12401.061,0,64.9270209424084,0,82.3117838754418,0,206.68435,27.8695,10.0252166666667
"3M_2May18","2018-05-02","2018-05-29","2018-05-02 10:16:18","2018-05-23 09:46:13",27,20.9791087962963,1028,"3M",41.66844,-121.89818,"Mule Deer","51","RL, JH","Antelope Sink","No sign of 3M when we approached","Adult","Female","3M","UNKNOWN; SQUIRREL Douglas; SQUIRREL California ground; SQUIRREL golden-mantled ground; COYOTE; BEAR black; WOODRAT white-footed; CHIPMUNK; SQUIRREL western gray; MOUSE; BIRD (other); PUMA",12,0,FALSE,TRUE,FALSE,TRUE,TRUE,0,0,0,0,0,0,0,29,2,24,0,2,0,0,29,3417.434,0,62.1351636363636,0,60.9907390091326,0,56.9572333333333,106.0291,4.67695
"3M_2Sep17","2017-09-02","2017-09-27",NA,NA,24,NA,0,"3M",41.67079,-122.24544,"Mule Deer","60","WB, EL","Miller Mt","Camera moved by bear part of the way through","Adult","Male",NA,NA,0,0,FALSE,FALSE,FALSE,FALSE,FALSE,0,0,0,0,0,0,0,0,0,0,0,0,0,0,0,0,0,0,0,NA,NA,0,0,0
"3M_4Jan18","2018-01-04","2018-01-25","2018-01-04 13:35:13","2018-01-13 23:27:51",21,9.41155092592593,1657,"3M",41.68008,-121.95996,"Mule Deer","56","WB, RL","Orr Mt","No sign of 3M when deploying cam. 3 bear scats found.","Adult","Male","3M","UNKNOWN; BEAR black; EAGLE golden; MAGPIE; JAY Stellar's; RAVEN common; EAGLE bald; FOX gray; BIRD (other); COYOTE; PUMA",11,0,FALSE,TRUE,FALSE,TRUE,TRUE,0,0,0,0,0,0,0,10,0,0,0,0,0,0,10,1231.157,0,45.5984074074074,0,39.2738292321796,0,20.5192833333333,66.4841,168.594416666667
"3M_7Jan19","2019-01-07","2019-02-05","2019-01-07 10:30:13","2019-01-27 17:24:08",29,20.2874421296296,851,"3M",41.68502,-121.98296,"Mule Deer","54","WB, EW","Orr Mt","Fresh lion tracks leaving cache site but no we did not see 3M.","Adult","Female","3M","UNKNOWN; ROBIN American; SKUNK striped; MAGPIE; EAGLE golden; HUMAN; BOBCAT; PUMA",8,0,FALSE,FALSE,TRUE,FALSE,TRUE,0,0,0,0,0,0,0,41,10,18,5,2,0,0,41,560.582,0,26.694380952381,0,28.6579405339536,0,9.34303333333333,0,81.74235
"3M_7Jul18","2018-07-07","2018-07-31","2018-07-07 12:48:13","2018-07-28 21:13:35",24,21.3509490740741,645,"3M",41.64955,-122.14075,"Elk","","JH, JT","Grass Lake","No sign of 3M, forgot to write down python lock number, used a brown one, Jordan will retrieve it","Calf","Male","3M","UNKNOWN; BIRD (other); BOBCAT; CHIPMUNK; SQUIRREL golden-mantled ground; COW domestic; MOUSE; COYOTE; RAVEN common; SKUNK striped; DEER Mule; PUMA",12,0,FALSE,FALSE,TRUE,TRUE,TRUE,0,0,0,0,0,0,0,6,0,14,0,0,0,0,6,947.246,0,94.7246,0,84.9821581930911,0,15.7874333333333,0,3.76306666666667
"3M_9Nov18","2018-11-09","2018-12-02",NA,NA,23,NA,0,"3M",41.68355,-121.94104,"Mule Deer","52","JH, WB","Orr Mountain ","Camera is screwed to tree! Completed kill site veg already, just need cache veg data and nearest edge","Yearling","Unknown",NA,NA,0,0,FALSE,FALSE,FALSE,FALSE,FALSE,0,0,0,0,0,0,0,0,0,0,0,0,0,0,0,0,0,0,0,NA,NA,0,0,0
"4M_10May18","2018-05-10","2018-06-05",NA,NA,26,NA,0,"4M",41.68955,-122.24617,"Mule Deer","58","EL, JH","Miller Mt, C1","4M not on carcass","Adult","Female",NA,NA,0,0,FALSE,FALSE,FALSE,FALSE,FALSE,0,0,0,0,0,0,0,0,0,0,0,0,0,0,0,0,0,0,0,NA,NA,0,0,0
"4M_11Jul18","2018-07-11","2018-08-12","2018-07-11 15:50:50","2018-08-01 16:46:01",32,21.0383217592593,1808,"4M",41.6643,-122.13796,"Elk","","JK, WB","Grass Lake","No sign of 4M","Yearling","Female","4M","UNKNOWN; VULTURE turkey; RAVEN common; COYOTE; CHIPMUNK; MOUSE; SQUIRREL golden-mantled ground; BIRD (other); BOBCAT; SKUNK western spotted; GROUSE; PUMA",12,0,FALSE,FALSE,TRUE,TRUE,TRUE,0,0,0,0,0,0,0,1,0,0,0,0,0,0,1,0,0,0,0,NA,NA,0,0,49.0446666666667
"4M_11May17","2017-05-11","2017-07-08","2017-05-11 12:39:42","2017-06-01 11:38:22",58,20.9574074074074,289,"4M",41.59036,-121.83744,"Mule Deer","","WB, RL","Garner Mt","HW & BC picked up","Adult","Male","4M","UNKNOWN; SQUIRREL California ground; DEER Mule; BEAR black; COYOTE; SQUIRREL Douglas; LAGOMORPH; PUMA",8,0,FALSE,TRUE,FALSE,TRUE,TRUE,0,0,0,0,0,0,0,1,0,0,0,0,0,0,1,0,0,0,0,NA,NA,0,8.24951666666667,0.208566666666667
"4M_12Apr17","2017-04-12","2017-05-13","2017-04-12 12:19:00","2017-05-03 15:52:29",31,21.1482523148148,307,"4M",41.70052,-122.03389,"Mule Deer","","BC, WB","Mt Hebron","2 cameras deployed","Adult","Female","4M","UNKNOWN; CHIPMUNK; SQUIRREL golden-mantled ground; VULTURE turkey; MOUSE; FOX gray; RAVEN common; PUMA",8,0,FALSE,FALSE,FALSE,FALSE,TRUE,0,0,0,0,0,0,0,10,0,16,0,0,0,0,10,0,0,0,0,NA,NA,0,0,5.23983333333333
"4M_13Mar18","2018-03-13","2018-04-05","2018-03-13 08:32:04","2018-04-03 10:13:25",23,21.1120486111111,285,"4M",41.66253,-121.93356,"Mule Deer","54","RL, EL","N Tennant x Old State","","Adult","Female","4M","UNKNOWN; COYOTE; MAGPIE; RAVEN common; RAT; ROBIN American; BIRD (other); JAY Stellar's; LAGOMORPH; SQUIRREL golden-mantled ground; CHIPMUNK; DEER Mule; PUMA",13,0,FALSE,FALSE,FALSE,TRUE,TRUE,0,0,0,0,0,0,0,31,0,14,0,0,0,0,31,457.08,0,20.7763636363636,0,15.7393428874314,0,7.618,0,2.68015
"4M_17May17","2017-05-17","2017-07-08","2017-05-17 15:16:43","2017-05-22 20:03:43",52,5.19930555555556,1110,"4M",41.54189,-121.86749,"Mule Deer","52","WB, RL","Little Horse Peak","Double kill found while searching cluster; placed cam on 2nd, pretty intact carcass. HW & BC picked up","Adult","Female","4M","UNKNOWN; LAGOMORPH; MOUSE; SQUIRREL Douglas; BEAR black; PUMA",6,0,FALSE,TRUE,FALSE,FALSE,TRUE,0,0,0,0,0,0,0,24,0,1,0,0,0,0,24,486.736,0,24.3368,0,14.090075258848,0,8.11226666666667,68.4127166666667,0
"4M_19May18","2018-05-19","2018-06-15",NA,NA,27,NA,0,"4M",41.60898,-122.18353,"Mule Deer","56","WB, JK","Deer Mt","No sign of 4M during deployment.","Adult","Female",NA,NA,0,0,FALSE,FALSE,FALSE,FALSE,FALSE,0,0,0,0,0,0,0,0,0,0,0,0,0,0,0,0,0,0,0,NA,NA,0,0,0
"4M_24Apr18","2018-04-24","2018-05-16","2018-04-24 10:04:07","2018-05-16 00:00:04",22,21.5805208333333,1673,"4M",41.53578,-122.18973,"Elk","57","WB, EL","Whaleback","No sign of 4M when deploying camera.","Yearling","Male","4M; PUMA unidentifiable","UNKNOWN; VULTURE turkey; COYOTE; RAVEN common; SQUIRREL golden-mantled ground; BEAR black; PUMA",7,0,FALSE,TRUE,FALSE,TRUE,TRUE,0,0,0,0,0,0,0,74,0,3,0,0,0,0,74,4849.024,0,39.1050322580645,0,34.6347360699212,0,80.8170666666667,144.52295,75.7318833333333
"4M_26Mar18","2018-03-26","2018-04-17","2018-03-26 13:49:53","2018-04-14 23:19:15",22,19.4370601851852,499,"4M",41.5019,-122.27407,"Mule Deer","53","RL, WB","Bolam","No sign of 4M when deploying camera.","Adult","Male","4M","UNKNOWN; JAY Stellar's; BIRD (other); FOX gray; LAGOMORPH; BEAR black; PUMA",7,0,FALSE,TRUE,FALSE,FALSE,TRUE,0,0,0,0,0,0,0,14,0,22,0,0,0,0,14,1103.556,0,44.14224,0,39.4794471806534,0,18.3926,29.6611333333333,0.0297333333333333
"4M_31Aug18","2018-08-31","2018-11-12","2018-08-31 09:52:22","2018-09-20 12:39:26",72,20.1160185185185,410,"4M",41.80421,-122.17213,"Mule Deer","51","WB, EW","Ball Mt","No sign of 4M, when retrieved the cluster was no longer in the app","Yearling","Female","4M; 3M","UNKNOWN; MOUSE; BIRD (other); COW domestic; BEAR black; CHIPMUNK; SKUNK striped; PUMA",8,0,FALSE,TRUE,FALSE,FALSE,TRUE,0,0,0,0,0,0,0,29,0,3,0,0,0,0,29,1931.865,0,49.535,0,43.1523162725271,0,32.19775,38.3703833333333,0.160933333333333
"4M_3Apr17","2017-04-03","2017-05-11","2017-04-03 13:51:27","2017-04-07 16:39:32",38,4.11672453703704,2931,"4M",41.66125,-121.83669,"Elk","","BC, WB","Long Prairie","2 cameras deployed; 1 had batteries die, other SD card filled up","Adult","Female","4M; 3M","UNKNOWN; COYOTE; MAGPIE; RAVEN common; ELK; EAGLE golden; VULTURE turkey; MOUSE; BEAR black; PUMA",10,0,FALSE,TRUE,FALSE,TRUE,TRUE,0,0,0,0,0,0,0,46,0,3,0,0,0,0,46,1399.765,0,25.9215740740741,0,22.4253332712046,0,23.3294166666667,2.71651666666667,1046.48681666667
"4M_5Apr18","2018-04-05","2018-04-27","2018-04-05 09:41:58","2018-04-26 07:58:07",22,20.9278819444444,860,"4M",41.37812,-122.28384,"Mule Deer","51","RL, BC","Mount Shasta","","Adult","Female","4M","UNKNOWN; FOX gray; CHIPMUNK; SKUNK striped; BIRD (other); JAY Stellar's; PUMA",7,0,FALSE,FALSE,FALSE,FALSE,TRUE,0,0,0,0,0,0,0,88,0,31,0,7,0,0,88,5800.242,0,47.1564390243902,0,46.0139255290457,0,96.6707,0,21.4323666666667
"5M_12Sep18","2018-09-12","2018-10-25","2018-09-12 11:18:38","2018-09-17 20:39:55",42,5.38978009259259,1539,"5M",41.61886,-121.7976,"Mule Deer","60","JK, EW","Garner Mountain","Did not hear 5M on Omni while approaching ","Adult","Male","5M","UNKNOWN; CHIPMUNK; MOUSE; LAGOMORPH; PUMA",5,0,FALSE,FALSE,FALSE,FALSE,TRUE,0,0,0,0,0,0,0,208,8,79,0,3,0,1,208,15708.949,0,55.3132007042254,0,70.3886753885347,0,261.815816666667,0,0.0576833333333333
"5M_14Nov17","2017-11-14","2017-12-11","2017-11-14 11:58:15","2017-12-05 17:29:11",27,21.2298148148148,632,"5M",41.57526,-121.40117,"Mule Deer","54","RL, EL","East of Glass Mountain","","Fawn","Male","5M","UNKNOWN; COYOTE; CHIPMUNK; BIRD (other); RAVEN common; SQUIRREL Douglas; PUMA",7,0,FALSE,FALSE,FALSE,TRUE,TRUE,0,0,0,0,0,0,0,1,0,0,0,0,0,0,1,0,0,0,0,NA,NA,0,0,59.67325
"5M_17Jan18","2018-01-17","2018-02-14","2018-01-17 11:03:14","2018-02-07 04:46:51",28,20.7386226851852,836,"5M",41.63424,-121.89897,"Mule Deer","54","RL, EL","Tennant","No sign of 5M when setting camera, in sage brush, used stake to put up camera","Adult","Female","5M","UNKNOWN; RAVEN common; DOG domestic; COYOTE; BIRD (other); PUMA",6,0,FALSE,FALSE,FALSE,TRUE,TRUE,0,0,0,0,0,0,0,65,48,26,1,1,0,0,65,2410.997,0,40.1832833333333,0,36.2363315365042,0,40.1832833333333,0,41.0215
"5M_18May17","2017-05-18","2017-07-09","2017-05-18 10:27:03","2017-06-07 21:07:29",52,20.4447453703704,1080,"5M",41.67039,-121.78627,"Mule Deer","54","WB, RL","Wild Horse Mt","HW & BC picked up","Adult","Female","5M","UNKNOWN; CHIPMUNK; SQUIRREL golden-mantled ground; WOODRAT white-footed; SQUIRREL California ground; SQUIRREL Douglas; LAGOMORPH; SKUNK western spotted; VULTURE turkey; BIRD (other); SKUNK striped; PUMA",12,0,FALSE,FALSE,FALSE,FALSE,TRUE,0,0,0,0,0,0,0,110,2,55,0,0,0,1,110,8194.65,0,44.0572580645161,0,47.6533657119157,0,136.5775,0,4.97816666666667
"5M_1Nov17","2017-11-01","2017-11-28","2017-11-01 10:31:05","2017-11-05 06:22:21",27,3.82726851851852,1473,"5M",41.57354,-121.77453,"Mule Deer","57","RL, EL","Garner Mt","WB & EL picked up; Carcass use needs to be changed for what was found during deployment... no XR6 deployment form in folder.","Adult","Female","PUMA unidentifiable; 5M","UNKNOWN; SQUIRREL Douglas; PUMA",3,0,FALSE,FALSE,FALSE,FALSE,TRUE,0,0,0,0,0,0,0,179,0,57,0,6,0,5,179,15130.529,0,46.6991635802469,0,49.9297795943001,0,252.175483333333,0,0
"5M_21Sep18","2018-09-21","2018-10-13","2018-09-21 15:48:42","2018-10-12 10:57:02",21,20.755787037037,406,"5M",41.76755,-122.09,"Mule Deer","58","EW, BC","Ball Mt","Saw 5M for 2 seconds as it quietly and rapidly ran in big leaps up the forested slope coming from the direction of the carcass","Fawn","Unknown","5M","UNKNOWN; FOX gray; BOBCAT; MAGPIE; COYOTE; RACCOON; SKUNK striped; OTHER; PUMA",9,0,FALSE,FALSE,TRUE,TRUE,TRUE,0,0,0,0,0,0,0,30,1,5,0,0,0,0,30,1737.811,0,41.3764523809524,0,36.6159951075645,0,28.9635166666667,0,22.4261666666667
"5M_22Nov17","2017-11-22","2018-01-06","2017-11-22 11:21:57","2017-11-30 01:56:11",45,7.60710648148148,3337,"5M",41.61959,-121.73671,"Mule Deer","55","WB, EL","Garner Mt","EL briefly saw 5M run away as we approached, ~50m away from us.","Adult","Male","5M","UNKNOWN; RAVEN common; HAWK red-tailed; COYOTE; PUMA",5,0,FALSE,FALSE,FALSE,TRUE,TRUE,0,0,0,0,0,0,0,84,3,58,0,8,0,0,84,4825.675,0,34.7170863309353,0,32.4672252907366,0,80.4279166666667,0,513.650483333334
"5M_24Nov18","2018-11-24","2018-12-17","2018-11-24 16:22:53","2018-11-29 06:25:14",23,4.58496527777778,1586,"5M",41.64673,-121.78484,"Elk","51","BC, guest","Wildhorse Mt","No sign of 5M","Adult","Female","7M","UNKNOWN; SKUNK striped; PUMA",3,0,FALSE,FALSE,FALSE,FALSE,TRUE,0,0,0,0,0,0,0,228,86,88,42,12,1,0,228,9629.617,0,34.8899166666667,0,38.8035012320506,0,160.493616666667,0,27.9152
"5M_26Jul18","2018-07-26","2018-08-21","2018-07-26 20:00:56","2018-07-27 02:38:03",26,0.275775462962963,101,"5M",41.67215,-122.1331,"Elk","58","BC, AB","Little Deer Mt.","Approached from a lava escarpment and saw 5M from ~60 m away. He was in a gully below us at the base of lava escarpments. He was feeding on the elk. Observed him undetected for ~5 mins then slowly started the descent towards the elk. We got close and weren't stealthy, talking, footsteps made noise, but weak wind was blowing from his direction towards us. He still didn't detect us until we got to ~15 m from him. He looked at us for ~4 seconds, low growl then walked fast away in an opposite direction from us and up a vegetated lava escarpment. He didn't stop to look back, continued on, lost visual when he was ~40 m away.  ","Yearling","Male","5M","UNKNOWN; SKUNK western spotted; PUMA",3,0,FALSE,FALSE,FALSE,FALSE,TRUE,0,0,0,0,0,0,0,8,0,0,0,0,0,0,8,1021.5,0,42.5625,0,67.4229447140441,0,17.025,0,0
"5M_3Sep18","2018-09-03","2018-10-14","2018-09-03 10:26:22","2018-09-24 18:57:29",40,21.3549421296296,1214,"5M",41.71865,-122.15408,"Mule Deer","54 (Box 57)","JK, JH","Fox Flat ","No sign of 5M on receiver or approach; Kill site found ","Adult","Female","5M","UNKNOWN; CHIPMUNK; SQUIRREL golden-mantled ground; SKUNK western spotted; BIRD (other); SQUIRREL Douglas; VULTURE turkey; MOUSE; WOODRAT white-footed; PUMA",10,0,FALSE,FALSE,FALSE,FALSE,TRUE,0,0,0,0,0,0,0,11,0,8,0,0,0,0,11,1964.222,0,57.7712352941176,0,73.383227262489,0,32.7370333333333,0,14.1837833333333
"5M_5Sep17","2017-09-05","2017-10-06","2017-09-05 16:27:14","2017-09-26 11:00:16",30,20.7312731481481,2515,"5M",41.64235,-121.60676,"Mule Deer","57","WB, EL","Fourmile Hill","Saw 5M upon approach for setup. He was sitting ~10m from carcass and loped away when we were ~20m from him. Scavenger sign notes need to be updated with deployment vs retrieval.","Adult","Male","5M","UNKNOWN; RAVEN common; VULTURE turkey; EAGLE golden; COYOTE; BIRD (other); SQUIRREL golden-mantled ground; PUMA",8,0,FALSE,FALSE,FALSE,TRUE,TRUE,0,0,0,0,0,0,0,107,24,98,0,2,1,0,107,5857.014,0,39.04676,0,46.8957060285392,0,97.6169,0,889.453200000001
"7M_10May18","2018-05-10","2018-06-05",NA,NA,26,NA,0,"7M",41.49767,-121.83801,"Mule Deer","52","WB, EW","Asperin Butte","No sign of 7M when deploying camera.","Adult","Female",NA,NA,0,0,FALSE,FALSE,FALSE,FALSE,FALSE,0,0,0,0,0,0,0,0,0,0,0,0,0,0,0,0,0,0,0,NA,NA,0,0,0
"7M_15Feb18","2018-02-15","2018-03-21","2018-02-15 15:12:39","2018-02-25 17:10:25",34,10.0817824074074,964,"7M",41.62547,-121.84671,"Mule Deer","","BC, RL","Garner Butte","No sign of 7M when setting camera","Adult","Female","7M","UNKNOWN; MOUSE; JAY Stellar's; COYOTE; RAVEN common; JAY scrub; DEER Mule; SKUNK western spotted; FOX gray; ROBIN American; PUMA",11,0,FALSE,FALSE,FALSE,TRUE,TRUE,0,0,0,0,0,0,0,69,2,10,0,14,0,0,69,5338.544,0,42.708352,0,44.8841756348881,0,88.9757333333333,0,49.8732833333333
"7M_15Jan18","2018-01-15","2018-02-08","2018-01-15 15:30:56","2018-01-29 09:35:57",24,13.7534837962963,271,"7M",41.6522,-121.69286,"Mule Deer","57","BC, guest","East of Hill 23","No sign of 7M upon approach. Carcass secured with Python lock","Adult","Male","7M","UNKNOWN; SQUIRREL Douglas; BOBCAT; COYOTE; PUMA",5,0,FALSE,FALSE,TRUE,TRUE,TRUE,0,0,0,0,0,0,0,20,1,5,0,3,0,0,20,314.169,0,26.18075,0,22.3207698267576,0,5.23615,0,9.45276666666667
"7M_1Feb18","2018-02-01","2018-03-29","2018-02-01 11:23:55","2018-02-18 15:15:05",56,17.1605324074074,49,"7M",41.64445,-121.79482,"Mule Deer","57","RL, EL","North of Gardiner Mtn.","No sign of 7M when setting camera","Adult","Female","7M","UNKNOWN; COYOTE; SQUIRREL Douglas; MOUSE; BIRD (other); CHIPMUNK; PUMA",7,0,FALSE,FALSE,FALSE,TRUE,TRUE,0,0,0,0,0,0,0,4,2,1,0,1,0,0,4,0,0,0,0,NA,NA,0,0,0
"7M_22Jan18","2018-01-22","2018-02-15","2018-01-22 11:11:24","2018-02-02 19:31:28",24,11.3472685185185,233,"7M",41.65615,-121.69997,"Mule Deer","52","RL, EL","Four Corners","No sign of 7M when setting camera, used camera stake","Adult","Male","7M","UNKNOWN; RAVEN common; COYOTE; PUMA",4,0,FALSE,FALSE,FALSE,TRUE,TRUE,0,0,0,0,0,0,0,25,32,1,0,19,0,0,25,1115.33,0,31.8665714285714,0,36.1413150858467,0,18.5888333333333,0,0.969133333333333
"7M_23Nov18","2018-11-23","2019-01-07","2018-11-23 16:54:45","2018-12-12 18:20:48",45,19.0597569444444,408,"7M",41.61287,-121.73378,"Mule Deer","53","WB, guest","Garner Mt","A bit of snow there showed 7M's tracks leaving cache site, and his beacon was bumping when we parked the truck, so we likely bumped him off the carcass.","Adult","Male","7M; PUMA unidentifiable","UNKNOWN; RAVEN common; COYOTE; SQUIRREL Douglas; BOBCAT; LAGOMORPH; PUMA",7,0,FALSE,FALSE,TRUE,TRUE,TRUE,0,0,0,0,0,0,0,59,12,42,1,9,2,0,59,514.686,0,19.7956153846154,0,22.1933055763704,0,8.5781,0,18.4513666666667
"7M_24Apr18","2018-04-24","2018-05-17","2018-04-24 14:17:57","2018-05-15 23:35:10",23,21.3869560185185,201,"7M",41.74989,-121.70531,"Mule Deer","59","WB, EL","Bonita Butte","Bumped 7M upon approach. First saw him trotting away from us at ~55m. He was likely sitting very close to the carcass.","Adult","Male","7M","UNKNOWN; VULTURE turkey; MOUSE; BOBCAT; WOODRAT white-footed; RAVEN common; COYOTE; PUMA",8,0,FALSE,FALSE,TRUE,TRUE,TRUE,0,0,0,0,0,0,0,0,0,0,0,0,0,0,0,0.993,0,0.993,0,NA,0,0.01655,0,5.76573333333333
"7M_24May18","2018-05-24","2018-06-16","2018-05-24 13:04:50","2018-06-14 23:29:11",23,21.4335763888889,1767,"7M",41.66157,-121.67216,"Mule Deer","59","WB, EW","Hill 23","Heard 7M on receiver before we approached but did not see him","Adult","Female","7M","UNKNOWN; COYOTE; CHIPMUNK; BEAR black; VULTURE turkey; SQUIRREL golden-mantled ground; LAGOMORPH; PUMA",8,0,FALSE,TRUE,FALSE,TRUE,TRUE,0,0,0,0,0,0,0,232,230,53,0,33,1,1,232,3154.86,0,28.1683928571429,0,20.371553120638,0,52.581,18.9707666666667,105.572066666667
"7M_25Aug18","2018-08-25","2018-09-17","2018-08-25 14:50:20","2018-09-12 10:46:42",23,17.8308101851852,1399,"7M",41.59615,-121.7589,"Mule Deer","56","JH, BC","Tamarack Flat","No sign of 7M on approach, camera is screwed to log","Adult","Female","7M","UNKNOWN; CHIPMUNK; SQUIRREL golden-mantled ground; SQUIRREL Douglas; VULTURE turkey; RAVEN common; BIRD (other); PUMA",8,0,FALSE,FALSE,FALSE,FALSE,TRUE,0,0,0,0,0,0,0,47,0,2,0,0,0,0,47,5502.704,0,45.4768925619835,0,60.4141904971839,0,91.7117333333333,0,139.42955
"7M_29Apr18","2018-04-29","2018-05-24",NA,NA,25,NA,0,"7M",41.66167,-121.70919,"Mule Deer","54","RL, EL","E of Hill 22","Heard 7M on receiver before we approached but did not see him","Adult","Female",NA,NA,0,0,FALSE,FALSE,FALSE,FALSE,FALSE,0,0,0,0,0,0,0,0,0,0,0,0,0,0,0,0,0,0,0,NA,NA,0,0,0
"7M_29Sep18","2018-09-29","2019-07-22","2018-09-29 10:20:13","2018-10-20 13:45:49",296,21.1011111111111,492,"7M",41.60998,-121.6722,"Mule Deer","57","JH, WB","Little Mt. Hoffman ","No sign of 7M but did hear his collar on the reciever from the road. Slope 20%. Canopy cover 36.75. Aspect 256. Conifer mix, fir and pine. Shrubs mostly just seedlings, some gooseberry and ceanothus. Road used for nearest edge 160m. Nearest open 15m. Nearest hiding 2m. Camera still active. No kill site found all veg from cache site. No additional samples collected. No scavenger sign observed. 76-100% consumption. ","Fawn","Male","7M; PUMA unidentifiable","UNKNOWN; CHIPMUNK; BIRD (other); SQUIRREL Douglas; BOBCAT; MOUSE; OTHER; WOODRAT white-footed; BEAR black; ROBIN American; PUMA",11,0,FALSE,TRUE,TRUE,FALSE,TRUE,0,0,0,0,0,0,0,8,0,4,0,0,0,0,8,84.349,0,14.0581666666667,0,9.50734666280065,0,1.40581666666667,26.7305,2.71075
"7M_5Jul18","2018-07-05","2018-09-04","2018-07-05 16:15:52","2018-07-26 19:34:08",61,21.1376851851852,842,"7M",41.54074,-121.769,"Mule Deer","60","WB, TS","Red Cap Mt","No sign of 7M ","Adult","Female","7M","UNKNOWN; LAGOMORPH; CHIPMUNK; SQUIRREL Douglas; MOUSE; BOBCAT; VULTURE turkey; BIRD (other); BEAR black; PUMA",10,0,FALSE,TRUE,TRUE,FALSE,TRUE,0,0,0,0,0,0,0,9,6,4,0,9,0,0,9,511.61,0,63.95125,0,72.1930003467887,0,8.52683333333333,101.292333333333,0.737566666666667
"7M_8Aug18","2018-08-08","2018-09-04","2018-08-08 12:11:44","2018-08-29 22:19:42",27,21.4221990740741,2370,"7M",41.57119,-121.65154,"Mule Deer","57 (Box 59)","JK, BC","Little Mount Hoffman ","No sign of 7M on approach","Adult","Male","7M","UNKNOWN; RAVEN common; VULTURE turkey; BEAR black; BIRD (other); MOUSE; PUMA",7,0,FALSE,TRUE,FALSE,FALSE,TRUE,0,0,0,0,0,0,0,6,0,0,0,0,0,0,6,14.566,0,7.283,0,8.17274017695412,0,0.242766666666667,120.46725,772.396349999999
"7M_9Oct18","2018-10-09","2018-12-20","2018-10-09 13:20:39","2018-10-28 22:08:26",72,19.3665162037037,343,"7M",41.552,-121.816,"Mule Deer","55","EW, JH","Typhoon Mesa","","Adult","Male","7M; PUMA unidentifiable","UNKNOWN; BEAR black; BIRD (other); RAVEN common; CHIPMUNK; MOUSE; PUMA",7,0,FALSE,TRUE,FALSE,FALSE,TRUE,0,0,0,0,0,0,0,26,0,0,0,0,0,0,26,767.694,0,16.689,0,11.9801540780298,0,12.7949,4.81656666666667,1.21751666666667
"8F_14Dec18","2018-12-14","2019-01-09","2018-12-20 10:08:54","2018-12-19 16:28:18",26,-0.736527777777778,1824,"8F",41.61138,-121.82216,"Mule Deer","60","JH, JK","N Garner Mountain ","Bumped a cat on approach, not sure if 8F or a kitten; 8F heard on receiver from the truck","Adult","Female","8F; KITTEN1; KITTEN2","JAY Stellar's; UNKNOWN; FOX gray; RAVEN common; COYOTE; MOUSE; BOBCAT; ROBIN American; SQUIRREL Douglas; BIRD (other); PUMA",11,2,FALSE,FALSE,TRUE,TRUE,TRUE,113,71,2,28,18,1,2,30,0,1,21,0,0,0,143,3198.916,9292.206,59.2391851851852,59.186025477707,71.5627465019926,105.03180784843,208.185366666667,0,221.952383333333
"8F_16Jan18","2018-01-16","2018-02-11","2018-01-16 11:24:58","2018-02-06 23:46:09",26,21.5147106481481,240,"8F",41.70723,-122.01733,"Mule Deer","58","WB, RL","Mt Hebron","No sign of 8F or kittens when deploying camera.","Adult","Female","PUMA unidentifiable; KITTEN1; 8F; 1F; KITTEN2; KITTEN3; 3M","UNKNOWN; DEER Mule; SKUNK striped; PUMA",4,3,FALSE,FALSE,FALSE,FALSE,TRUE,6,4,0,18,4,0,0,14,2,0,1,2,0,0,20,536.349,1107.161,76.6212857142857,52.7219523809524,114.13407904261,54.8435769844347,27.3918333333333,0,0
"8F_19Jan18","2018-01-19","2018-02-10","2018-01-19 10:39:26","2018-02-09 04:47:08",22,20.7553472222222,981,"8F",41.69924,-122.02935,"Mule Deer","60","WB, RL","Mt Hebron","No sign of 8F or kittens when deploying camera; Lots of fresh tracks in the snow from them, though, and we picked up a strong VHF signal from her as we parked the truck.","Adult","Male","8F; KITTEN1; KITTEN2; KITTEN3","UNKNOWN; EAGLE golden; BIRD (other); MAGPIE; RAVEN common; COYOTE; DEER Mule; FOX gray; LAGOMORPH; PUMA",10,3,FALSE,FALSE,FALSE,TRUE,TRUE,30,2,0,42,1,0,0,34,0,0,4,0,0,0,64,1127.482,3686.648,36.3703870967742,68.2712592592593,42.7810889121797,78.4895237970889,80.2355,0,119.594866666667
"8F_20Nov18","2018-11-20","2019-07-18","2018-11-20 12:52:48","2018-11-22 00:16:03",240,1.47447916666667,1063,"8F",41.40966,-122.10427,"Mule Deer","56","WB, guest","E Mt Shasta","No sign of 8F or kittens, but we heard her beacon when parking truck. Retrieval: prey record no longer in app. Cam was off, veg done at cache pile (full of hair and remaining bones). No scavenger sign discernible. Aspect: 87, slope: 24, CC: 31.25, red Fir, no shrubs/shrub cover, nearest edge: 100m, nearest open: 8m  ","Adult","Female","8F; KITTEN1","UNKNOWN; BEAR black; PUMA",3,1,FALSE,TRUE,FALSE,FALSE,TRUE,1,0,0,0,0,0,0,16,0,0,0,0,0,0,17,349.095,0,19.3941666666667,0,19.7440837460387,0,5.81825,321.766616666667,0
"8F_21Sep18","2018-09-21","2018-10-25","2018-09-21 13:27:15","2018-10-12 17:02:43",33,21.107962962963,802,"8F",41.55665,-121.74346,"Mule Deer","56","EW, BC","Red Cap Mt","No sign of 8F","Fawn","Male","KITTEN1; KITTEN2; 8F; PUMA unidentifiable","UNKNOWN; SKUNK striped; BEAR black; SQUIRREL Douglas; MOUSE; LAGOMORPH; SQUIRREL golden-mantled ground; CHIPMUNK; PUMA",9,2,FALSE,TRUE,FALSE,FALSE,TRUE,33,1,1,2,0,1,2,7,2,0,1,0,0,0,40,299.399,1591.127,19.9599333333333,46.7978529411765,21.7452729262729,83.7316108792388,31.5087666666667,115.251566666667,0
"8F_22Mar18","2018-03-22","2018-04-14","2018-03-22 16:28:58","2018-04-12 12:04:42",23,20.8581481481481,1907,"8F",41.70523,-121.99333,"Mule Deer","59","BC","Mt Hebron","Collared doe","Adult","Female","KITTEN1; KITTEN2; KITTEN3; 8F; 3M","UNKNOWN; FOX gray; CHIPMUNK; BIRD (other); DEER Mule; SQUIRREL California ground; REPTILE; SQUIRREL golden-mantled ground; PUMA",9,3,FALSE,FALSE,FALSE,FALSE,TRUE,51,49,0,36,25,1,0,57,29,1,1,7,0,0,108,1026.917,2220.11,24.4504047619048,32.1755072463768,22.7268943067937,36.3155668256916,54.1171166666667,0,5.84566666666667
